jobid;company;job-title;Seniority level;Employment type;Job function;Industries;description;ranking;explanation
3808800622;CBTW;CLOUD- UND DEVOPS-ENGINEER (M/W/D);Entry level;Full-time;Consulting;IT Services and IT Consulting;"Positive Thinking Company ist Teil unseres weltweiten Ökosystems ""Collaboration betters the world"". Unsere 6 Gründungspartner Positive Thinking Company, Steep, Versett, Alispharm, Otofacto & OneAston helfen dabei das Unternehmenswachstum unserer Kund:innen durch Strategie, Technologie und Design zu verwirklichen.
Wir suchen dein Talent und deine Leidenschaft zur Verstärkung unserer Data & Analytics Expert:innen. Schließ dich uns an, entfalte deine Fähigkeiten und Talente und stecke unsere Community mit deiner Begeisterung und deinen Ideen an. Was uns wichtig ist? Die 3 W’s: Wissensaustausch, Weiterbildungen und Weiterentwicklung. Interessiert? Dann wird’s jetzt spannend:
Aufgaben
Als DevOps CI/CD Engineer (m/w/d) verantworten Sie AWS (oder andere) Cloud-basierte Produktionssysteme, um die Verfügbarkeit, Leistung, Skalierbarkeit und Sicherheit von Systemen zu gewährleisten. Im Detail bedeutet das:
Sicherstellung von Bau-, Freigabe- und Konfigurationsmanagement von Produktionssystemen sowie die Abnahme und Prüfung zur Qualitätssicherung
Weitergabe von Best Practices im Bereich DevOps Engineering an andere Teams
Problembehebung unter Einbeziehung entsprechender Ressourcen und Förderung der Lösung von Problemen
Dieses Wissen bietet unseren Kund:innen echten Mehrwert. Du bist das Bindeglied zwischen IT und Business. Du konzipierst. Du realisierst. Du treibst voran.
Qualifikation
Dein Talent
Deine größte Leidenschaft ist, am Puls der Zeit mit 
Cloud Plattformen
 Applikationen zu realisieren und entwerfen. Dabei hast Du mit 
Technologien
 wie Kubernetes, Ansible und Docker sowie mit Cloud Native Bereitstellung für AWS, 
Frameworks
 wie Jenkins/Bamboo, Monitoring Frameworks wie Prometheus, Grafana, Icinga or Nagios und Code Depots auf GitHub und mit mindestens einer 
Programmiersprache
 wie Java, Python, Node.JS or C++ gearbeitet. Außerdem bist Du ein ausgebildeter 
Informatiker
 (m/w/d) oder hast einen vergleichbaren Background. 
Deutsch
 und 
Englisch
 kannst Du verhandlungssicher anwenden und Du bist 
DACH-weit reisebereit
.
Benefits
Wir bieten Dir eine Kultur, die von unseren Führungsleitsätzen angetrieben wird: Unternehmerisch, ergebnisorientiert, Eigenverantwortung fördernd und sich gegenseitig zum Erfolg verhelfend. Wir schaffen Transparenz über Unternehmensziele, Zusammenarbeit und Unterstützung durch ein internationales Team auf Augenhöhe. Wir leben Austausch, Teamgeist und einen respektvollen Umgang miteinander. Das verbindet uns hierarchieübergreifend – auch im Home-Office. So erhielten wir in 2022 die kununu Auszeichnung „TOP Company“.
Das erwartet Dich bei uns:
Onboarding: Du bist ab dem ersten Tag intern vernetzt: Welcome Day, Hello Drink, Mentoring-Programm
Entwicklung: Entwicklung ist bei uns individuell auf Deine Stärken ausgerichtet: Regelmäßige Feedbackgespräche, Karrierepfade, Career Committees, Online Trainingskatalog, Internationales Arbeiten mit unterschiedlichen Kulturen
Work-Life Balance: Raum für Deine persönliche Lebensplanung (Sabbatical, Remote Working aus dem Ausland, hochflexible Arbeitsmodelle, Elternzeitprogramme, 30 Tage Urlaub, Feiertagskalender Baden-Württemberg)
Nachhaltigkeit: Uns ist es wichtig, dass unsere Arbeit einen positiven Einfluss auf die Umwelt und die Menschheit hat. Dafür machen wir unsere Lösungen und unsere Zusammenarbeit jeden Tag ein Stückchen nachhaltiger. 
Events: Fachlich und mit Spaßfaktor (Summer-Tech-Event, lokale Afterworks, Sportevents, Teamevents, Weihnachtsfeiern)
Netzwerken: Connecte Dich mit Deinen Kolleg:innen: Communities, Lunch Breaks, interne Know-How Sessions
Fehlerkultur: Mache Fehler und teste Dich aus: Wir geben Dir den Freiraum neuesten Technologien zu arbeiten
Prämien: Eine Vielzahl an Prämien für Dein zusätzliches Engagement
Weitere Vorteile: Corporate Benefits, Jobfahrrad, betriebliches Gesundheitsmanagement
Kein:e Kandidat:in wird jede dieser gewünschten Anforderungen erfüllen. Wenn Deine Erfahrungen etwas anders aussehen und Du denkst Du kannst dieser Stelle einen anderen Mehrwert verleihen, lass uns gerne darüber sprechen!
Check unsere PTC Spotify Playlist aus und mache dir einen ersten musikalischen Eindruck von unserem Team: https://open.spotify.com/playlist/44kgWZRt5jmmgppH0qGszg?si=L312ch\_9SMKsCKBcN-EB\_A
Aber genug von uns, jetzt bist Du dran - Wir freuen uns darauf Dich kennenzulernen!";6.0;Ich passe recht gut zur Stellenbeschreibung, da ich Erfahrung mit Cloud-basierten Produktionssystemen habe und mit Technologien wie Kubernetes, Docker und Jenkins gearbeitet habe. Ich habe auch Erfahrung in der Programmierung mit Python und C++. Allerdings habe ich keinen Hintergrund als Informatiker und meine Erfahrung mit DevOps Engineering ist begrenzt. Dennoch bin ich bereit zu lernen und mich weiterzuentwickeln, was ein wichtiger Aspekt dieser Stelle ist.
3775651746;Atruvia AG;(Junior) System Engineer Identity- & Access-Management (m/w/d);Entry level;Full-time;Information Technology;IT Services and IT Consulting;"Vollzeit
Wir sind der Digitalisierungspartner der genossenschaftlichen FinanzGruppe und vereinen jahrzehntelange Banking-Expertise mit moderner Informationstechnologie. Die speziell auf Banken zugeschnittenen IT-Lösungen und Leistungen reichen vom Rechenzentrumsbetrieb über das Bankverfahren agree21 bis hin zur App-Entwicklung. Dabei nutzen wir zukunftsweisende Technologien wie künstliche Intelligenz oder Smart Data und schreiben Prozessoptimierung und Regulatorik groß.
Wir haben uns zum Ziel gesetzt, innovative digitale Banking- und Near-Banking-Erlebnisse für über 1.000 Banken und mehr als 30 Millionen Bankkund*innen zu ermöglichen. Daher investieren wir systematisch in das Know-how unserer mehr als 4.900 Mitarbeitenden und betrachten Nachhaltigkeit als strategisches Unternehmensziel.
Unser Zusammenarbeitsmodell zeichnet sich durch eine agile, crossfunktionale Arbeitsweise in allen Unternehmensbereichen aus. Wir verbinden Menschen und Märkte von morgen – einfach. digital. sicher.
Wir suchen dich für unser Servicefeld Plattformservices im Tribe Identity and Access Management.
Aufgaben mit Perspektiven
Du bist in die Entwicklung, die Bereitstellung und den Betrieb von IT-Services für das Identity- und Access-Management auf Basis modernster Technologien und Protokolle eingebunden.
Du kannst deine Skills beim Erarbeiten und Abstimmen von Lösungsarchitekturen ausbauen, bevor du zusammen mit deinem Team die Entwicklung der Module realisierst.
Eine enge Zusammenarbeit mit diversen Projekten, die Lösungen rund um das Thema digitale Identitäten benötigen, sowie die Unterstützung Dritter bei der Anbindung von Systemen und Applikationen an die Identity- und Access-Management-Lösungen unseres Unternehmens, sind Teil deiner Aufgabe.
Neben der Vorbereitung von Softwareeinführungen kümmerst du dich auch um die Sicherstellung einer reibungslosen Übernahme in den produktiven Betrieb.
Eine kontinuierliche Verbesserung unserer Lösungen sollte auch von dir mitgetragen werden.
Persönlichkeit mit Profil
Du verfügst über ein abgeschlossenes Studium der Informatik sowie mehrjährige einschlägige Berufserfahrung oder eine Ausbildung im IT-Bereich und langjährige einschlägige Berufserfahrung oder eine vergleichbare Qualifikation.
Du bringst Kenntnisse im Bereich Identity- und Access-Management-Verfahren (z. B. OAuth, OpenID) mit.
Kenntnisse in agiler Softwareentwicklung und einer verbreiteten Programmiersprache sowie von Linux-/Unix-basierten Betriebssystemen und relationalen Datenbanken würden wir uns von dir wünschen.
Mit Cloud-Diensten bist du schon in Berührung gekommen und möchtest deine Kenntnisse vertiefen.
Du überzeugst durch ein hohes Maß an Eigeninitiative und bist bereit, nach einer ausgiebigen Einarbeitungsphase, an der Rufbereitschaft teilzunehmen.
Nobody is perfect! Du erfüllst die Anforderungen nicht zu 100 % und hast dennoch Lust auf den Job? Kein Problem – wir gehen den Weg gemeinsam als Team – inklusive Einarbeitung und passgenauen Entwicklungsmaßnahmen!
Unsere Vorteile auf einen Blick
Neben einem attraktiven Tarifgehalt und 30 Tagen Urlaub bieten wir dir folgende Benefits:
Flexibles Arbeiten:
 Wir arbeiten in einem ausgewogenen hybriden Mix aus Remote Work und Anwesenheit in modernen Bürowelten (Activity Based Working).
Work-Life-Balance:
 Mit unseren individuellen Arbeitszeitmodellen wie z. B. Teilzeit, der Wahlmöglichkeit in Vollzeit zwischen 30-40 h und unserem Lebensarbeitszeitkonto (Sabbatical und/oder Freistellung vor Rentenbeginn) findest du den passenden Ausgleich.
Vereinbarung von Privatleben und Karriere: 
Wir bieten dir ein Familienbudget und unterstützen in besonderen familiären Situationen wie z. B. der Pflege von Familienangehörigen.
Individuelle Benefits:
 Du hast die Wahl zwischen Bike-Leasing, IT-Hardware-Leasing, vermögenswirksamen Leistungen und/oder einem zusätzlichen Freistellungstag sowie einer betrieblichen Altersvorsorge und weiteren Optionen.
Onboarding:
 Wir begrüßen dich bei unserer Willkommensveranstaltung #enter; zudem erwarten dich eine strukturierte Einarbeitung mit Pat*in sowie regelmäßige Feedbackgespräche mit deinem People Lead.
Gesundheitsmanagement – Health, Family and Life:
 Mit unseren Angeboten begleiten und unterstützen wir dich u. a. durch Kooperationen mit der Familiengenossenschaft und voiio. Ernähre dich vielfältig in unseren Betriebsrestaurants und vernetze dich bei unseren Sportangeboten. 
Karrieremodell und Weiterbildung:
 In unseren Entwicklungsdialogen besprichst du deine fachlichen, methodischen und persönlichen Karriereziele und verfolgst diese mittels unserer vielfältigen Weiterbildungsangebote.
Unsere Unternehmenswerte:
 Respektvoll, offen und ehrlich, eigenverantwortlich, füreinander und ergebnisorientiert – dabei leiten uns Teamgeist sowie der Wunsch nach Innovation und intensivem Wissensaustausch.
Zukunfts- und Arbeitsplatzsicherheit:
 Als genossenschaftliches Unternehmen mit jahrzehntelanger Erfahrung sind wir Vordenker der digitalen Transformation in der Bankenwelt und systemrelevanter Arbeitgeber.
Kununu
: Wir sind Top Company 2023 und stolz auf einen Kununu-Score von 4,1 und eine Weiterempfehlungsquote von 93 %.
Bewirb dich jetzt!
Bitte nutze für deine Bewerbung ausschließlich unser Bewerbungsportal über den Button „Bewerben“.
Kennziffer: IN302 PLSIAM
Wir freuen uns auf dich.
#atruvia #it-jobs #wearehiring #systemengineering #accessmanagement";5.5;Based on your experience and skills in software development, particularly in Python and C++, as well as your knowledge of SQL, you have some relevant knowledge for this role as a (Junior) System Engineer in Identity and Access Management. However, your specific experience in Identity and Access Management procedures such as OAuth and OpenID is not mentioned in your CV. Additionally, your experience with agile software development and Linux/Unix-based operating systems is not explicitly stated. Therefore, while you have some relevant skills, there are also gaps in your experience for this specific role.
3807563487;arconsis;SENIOR SOFTWARE ENGINEER – CLOUD (ALL GENDERS);;Full-time;;;"Du bist ein leidenschaftlicher und erfahrener Software Engineer mit einem starken Fokus auf Cloud-Technologien? Du hast Spaß an der Konzeption, Entwicklung und Bereitstellung von Cloud-nativen Anwendungen? Dann haben wir eine spannende Herausforderung für Dich! Verstärke unser Team als Senior Software Engineer (Cloud). 
WAS DICH ERWARTET 
Leitung des Entwurfs, der Entwicklung und des Einsatzes von skalierbaren Cloud-nativen Anwendungen 
Zusammenarbeit in funktionsübergreifenden Teams zum Entwurf und Implementierung robuster Cloud-Lösungen 
Mentoring und Training von Junior Software Engineers, Förderung einer Kultur der technischen Exzellenz und des kontinuierlichen Lernens 
Sei immer auf dem Laufenden über die neuesten Trends und bewährten Verfahren in den Bereichen Cloud-Technologien und Softwaretechnik 
Gewährleistung der Sicherheit, Zuverlässigkeit und Leistung von Cloud-basierten Systemen 
 
WER GUT ZU UNS PASST 
Nachgewiesene Erfahrung als Software Engineer mit starkem Fokus auf Cloud-Technologien (AWS, Azure oder GCP) 
Solides Verständnis von Cloud-Architekturen, Microservices und Containerisierung (Docker, Kubernetes) 
Kenntnisse in mindestens einer Programmiersprache (z. B. Kotlin, Java, TypeScript oder C#) 
Erfahrung mit CI/CD-Pipelines und automatisierten Bereitstellungstools 
Ausgeprägte Problemlösungsfähigkeiten und eine Leidenschaft für die Erstellung hochwertiger Softwarelösungen 
Ausgezeichnete Kommunikations- und Teamfähigkeiten 
Fließende Deutsch- und Englischkenntnisse 
Offene Denkweise, großes Interesse neue Technologien/Sprachen/ Frameworks auszuprobieren und zu nutzen 
 
WOFÜR WIR STEHEN 
Bei arconsis bist Du von Software Engineering-Enthusiasten umgeben und spannende Projekte warten auf Dich 
Wir lieben es, Wissen zu teilen und einander zu unterstützen 
Wir arbeiten als Team zusammen, um ein gemeinsames Ziel zu erreichen, und wissen, wie man die Dinge anpackt 
Offene Kommunikation, angenehmes Arbeitsklima mit coolen Kolleg:innen, innovativen Technologien und viel Spaß bei der Arbeit 
Ausgezeichnete Entwicklungs- und Trainingsmöglichkeiten, Brown-Bags, Meetups und die Möglichkeit Vorträge auf Konferenzen zu halten und Artikel zu schreiben 
Raum für Ideen und die Möglichkeit, Lösungen zu gestalten 
BENEFITS
Deutschland-Ticket (100% Kostenübernahme)
Moderne Ausstattung mit neuestem, leistungsstarkem Computer und Mobiltelefon
Jobrad-Leasing zu attraktiven Konditionen
Mitarbeiterrabatte (Corporate Benefits)
Mitarbeiterevents
Du bist bereit, mit uns zu lernen und zu wachsen? Dann freuen wir uns darauf, Sie kennen zu lernen. Schicken Sie uns Ihre Bewerbung! ";5.0;Aufgrund deiner Erfahrung mit Softwareentwicklung und deinem soliden Verständnis von Cloud-Architekturen und Microservices passt du gut zur Stellenbeschreibung. Allerdings fehlt dir Erfahrung mit konkreten Cloud-Technologien wie AWS, Azure oder GCP, was ein wichtiger Faktor für diesen Job ist. Du könntest dich dennoch bewerben und betonen, dass du bereit bist, dich in neue Technologien einzuarbeiten.
3722383120;LIONSTEP;Database Developer (w/m/d);Entry level;Full-time;Information Technology;Human Resources;"Für unseren Kunden 
 regiocom SE
 suchen wir per sofort: 
Datenbanken Entwickler (w/m/d) 
.
Job-Zusammenfassung
Du bist ein Allrounder in der Datenbankentwicklung und möchtest Deine Technologiekompetenz stetig weiterentwickeln? Dann aufgepasst! 👨‍💻🔧
Als Recruiting-Partner von regiocom SE suchen wir genau Dich als Datenbanken Entwickler (w/m/d) für Datenbanken zur Verstärkung ihres Softwareentwicklungs-Teams
. In dieser Position arbeitest Du an verschiedenen Projekten, analysierst bestehende Systeme und unterstützt die Kollegenschaft bei technischen Fragestellungen. Freue Dich auf eine individuelle Einarbeitung und flexible Arbeitsmöglichkeiten. Außerdem erhältst Du attraktive Mitarbeitervorteile und spannende Weiterbildungsmöglichkeiten. 💼💻💪
#Datenbankentwicklung #Softwareentwicklung #Technologiekompetenz #Allrounder #Weiterentwicklung #Flexibilität #Mitarbeitervorteile #Karrierechance #JobOpportunity
Was Du tun wirst
Entwicklung, Test, Dokumentation und Produktivsetzung von Softwaremodulen
Unterstützung bei der Erstellung von Anforderungsspezifikationen und Pflichtenheften sowie Projektplanung in Zusammenarbeit mit dem Projektmanagement
Fachliche Mitarbeit in Projekten unter Berücksichtigung der Projektvorgaben (z.B. Kosten, Termine, Qualität)
Analyse bestehender Applikationen/Systeme
Anpassung von Applikationen entsprechend Änderungsanforderungen
Bearbeitung von Störungsmeldungen im 2nd-/3rd-Level Support und ggf. deren Koordination
Durchführung von Tests im Rahmen der Qualitätssicherung
Selbständige Aktualisierung der eigenen Technologiekompetenz
Was Dich für den Job auszeichnet
(Fach-) Hochschulstudium (Informatik, technisch, naturwissenschaftlich) oder eine abgeschlossene Berufsausbildung in der IT (Fachinformatiker für Anwendungsentwicklung)
Mehrjährige Erfahrungen in der Datenbankentwicklung
Programmiersprache: PL/SQL
Datenbank-System: Oracle, PostgreSQL, MSSQL oder vergleichbare
Teamplayer mit ausgeprägten Kommunikationsfähigkeiten
Ge: C1 – Fachkundige Sprachkenntnisse
En: B1 – Fortgeschrittene Sprachverwendung
Team
Berichterstattung an: Projektmanager
Kolleg*innen: 14
Benefits
Zahlreiche Weiterbildungsmöglichkeiten
Moderne & barrierefreier Arbeitsplatz
Flexible Arbeitszeitmodelle 
Jobticket und Zuschuss für ÖPNV
Regelmäßige Augenuntersuchungen, Grippeschutzimpfungen & Massagen
Wasser, Tee und frisches Obst
Kostenlose Sportangebote
Kantine mit frischen Mahlzeiten
Teamveranstaltungen 
Werbeprämie für Empfehlungen, neuer Kollegen
Betriebliche Altersvorsorge & Gruppenunfallversicherung";5.0;Ich passe zum Teil zur Stellenbeschreibung als Datenbankentwickler. Ich habe Erfahrungen in der Datenbankentwicklung und kenne Programmiersprachen wie PL/SQL. Allerdings habe ich keine tiefergehenden Kenntnisse von Oracle, PostgreSQL oder MSSQL. Ferner habe ich in meiner Vita keine spezifischen Kenntnisse über Anforderungsspezifikationen oder Projektplanung erwähnt. Trotzdem könnte ich mich bewerben und hoffen, dass meine vorhandenen Kenntnisse ausreichen, um in der Position erfolgreich zu sein.
3808862397;fino;Software Engineer (all genders) - 100% Home Office;Entry level;Full-time;Information Technology;IT Services and IT Consulting;"Das Fintech-Unternehmen fino wurde 2015 in Kassel gegründet und ist Anbieter innovativer B2B SaaS-Geschäftsmodelle für Banken und Unternehmen. fino entwickelt einzigartige Lösungen, die Menschen begeistern und setzt Maßstäbedurch digitale und datenbasierte Geschäftsmodelle in den Bereichen Bank AccountMining (FinTech), Rechnungsmanagement und Dokumentenanalyse (DocTech), KYC/Geldwäsche (RegTech) und Grundsteuer (TaxTech).
Mit der kürzlichen Beteiligung an der Financial Software Architects GmbH (FISA) besetzt die fino Gruppe proaktiv das Zukunftsfeld ESG-/Nachhaltigkeitsreporting. Gemeinsam mit der FISA bauen wir diesen Wachstumsbereich aus, machen ESG-Datendigital nutzbar und ermöglichen Finanzmarkt-teilnehmern und Unternehmen neue,innovative Geschäftsmodelle auf dem Weg zur Klimaneutralität.
Unser Motto:„Less finance – more you“. Dieser Mission folgend stehen bei unserer Arbeit Leidenschaft und Spaß an erster Stelle. Für Dich auch? Dannlerne uns kennen und werde Teil unserer großen Familie!
Aufgaben
Du bist ein aktiver Gestalter und treibst die Entwicklung zukunftsweisender Produkte voran. In einem cross-funktionalen, agilen Team bestehend aus Business Development, Designern und Software Engineers trägst Du maßgeblich zur Umsetzung bei. Folgende Aufgaben gehören zu Deinem Tätigkeitsfeld:
Entwicklung von Produkten und Software auf höchstem Niveau
Mitgestaltung des Entwicklungsprozesses von der Idee bis zum fertigen Produkt
Entwurf und Implementierung skalierbarer und resilienter Microservices gemeinsam mit Deinem Team
Enge Zusammenarbeit und Austausch mit anderen Teams
Optimierung bestehender Codes, Architekturen und Entwicklungsprozesse
Wissensaustausch zur kontinuierlichen Verbesserung und zum Wachstum des Teams
Qualifikation
Erfahrung als Softwareentwickler:in oder Softwarearchitekt:in
Kenntnisse im Entwurf verteilter Systeme und Microservices
Mindestens erste Erfahrung in einer modernen Programmiersprache (Go, Java, C#, etc.) – alternativ bist Du motiviert, Go (Golang) zu lernen und produktiv einzusetzen
Optimalerweise kennst 
Du Konzepte wie Software Craftsmanship, Clean Code, Continuous Deployment und Test-driven development (TDD)
Mit agilem Mindset bevorzugst Du einen zügigen Livegang und behältst dabei die Qualität im Blick
Kommunikative Persönlichkeit
Offenheit für Neues
Benefits
Hey, bei uns bekommst du echt coole Benefits!
Du bekommst bei uns viel Eigenverantwortung und Gestaltungsspielraum, um deine Ideen umzusetzen. Außerdem kannst du von überall aus arbeiten, denn wir bieten dir Remote Work an. Und das Beste daran? Flexible Arbeitszeiten, damit du dein Leben und deine Arbeit besser vereinbaren kannst.
Wir legen großen Wert auf eine offene und direkte Kommunikation, damit Entscheidungen schnell und unkompliziert getroffen werden können. Unsere Belegschaft ist kollegial und motiviert, und wir haben eine flache Hierarchie. Wir bieten dir auch individuelle Weiterentwicklungsmöglichkeiten, damit du dich persönlich und beruflich weiterentwickeln kannst.
Als besonderes Highlight haben wir auch Corporate Benefits für unsere Mitarbeiter, damit du in den Genuss von verschiedenen Vergünstigungen kommst. Wir kümmern uns um deine Gesundheit mit verschiedenen Maßnahmen und bieten dir sogar hundefreundliche Arbeitsplätze, falls du deinen besten Freund mitbringen möchtest.
Und natürlich haben wir auch an deine Mobilität gedacht - wir haben Firmenparkplätze für dich. Und falls du mal nicht mehr arbeitest, kannst du dich auf eine betriebliche Altersvorsorge verlassen. Cool, oder?
Bei uns zählt jeder einzelne Mitarbeitende und deshalb möchten wir dich gerne kennenlernen. Unser Bewerbungsprozess ist einfach und transparent:
Sende uns deine vollständigen Bewerbungsunterlagen im PDF-Format zu (Anschreiben, Lebenslauf, optional Bewerbungsfoto). 
Wir bestätigen den Erhalt deiner Unterlagen per E-Mail. 
Wir führen Bewerbungsgespräche, um dich als Mensch kennenzulernen. 
Bewirb dich jetzt und werde Teil unseres Teams!";5.0;Die Stellenbeschreibung sucht nach jemandem mit Erfahrung als Softwareentwickler oder Softwarearchitekt, Kenntnissen im Entwurf verteilter Systeme und Microservices und idealerweise Kenntnissen in einer modernen Programmiersprache wie Go, Java oder C#. Obwohl ich Erfahrung als Softwareentwickler habe und Kenntnisse in den Programiersprachen Python und C++, habe ich keine spezifischen Erfahrungen mit den genannten Technologien. Allerdings bin ich motiviert, neue Technologien zu lernen und einzusetzen. Daher habe ich den Eindruck, dass ich mich für den Job bewerben könnte, aber es gibt wahrscheinlich Kandidaten, die besser zu den Anforderungen passen.
