jobid;company;job-title;Seniority level;Employment type;Job function;Industries;description;ranking;explanation
3645834601;KPMG Deutschland;(Junior) Consultant / Developer (w/m/d) RPA (Robotic Process Automation);Entry level;Full-time;Consulting, Information Technology, and Sales;Business Consulting and Services;"Als (Junior) Consultant / Developer (w/m/d) RPA (Robotic Process Automation) arbeitest Du mit uns an innovativen Lösungen, um die Geschäftsprozesse unserer Kundschaft zu automatisieren. Dabei nutzt Du state-of-the-art Robotics-Lösungen ebenso wie Elemente der Künstlichen Intelligenz, um in Deinen Projekten das optimale Ergebnis zu generieren.
Deine Aufgaben
Du willst die digitale Transformation mit großen Schritten vorantreiben und damit die Zukunft der Arbeitswelt aktiv mitgestalten? Dann kannst Du Dich hier einbringen:
Gemeinsam mit Deinem Team entwickelst Du Software-Roboter für unsere Kundschaft und arbeitest an der Etablierung eines Application Lifecycle Managements.
In enger Zusammenarbeit mit Deinen Fachkolleginnen und -kollegen identifizierst Du das Automatisierungspotential von Prozessen. 
Als Experte:in für RPA-Themen unterstützt Du unsere Mitarbeiter und Mitarbeiterinnen aus den Fachabteilungen bei ihren Fragen. 
Du bist verantwortlich für die Konzeption und Erstellung wiederverwendbarer Lösungen.
Darüber hinaus unterstützt Du bei der kontinuierlichen Weiterentwicklung von Konzepten, Methoden und Tools.
Dein Profil
(Junior) Consultant / Developer (w/m/d) RPA (Robotic Process Automation) wirst Du bei uns mit einem abgeschlossenen Studium der Informatik, Wirtschaftsinformatik, Wirtschaftswissenschaften, des Wirtschaftsingenieurwesens, des Ingenieurwesens oder der Naturwissenschaften.
Du kannst erste Erfahrungen mit einer RPA-Software wie Blue Prism, UiPath oder Softomotive Process Robot bzw. einem Testautomatisierungstool, z. B. Ranorex, Tosca vorweisen.
Du solltest ein grundlegendes Interesse an Prozessoptimierungen mitbringen.
Zudem verfügst Du über bereits nachweisbare Kenntnisse in einer Programmiersprache (C#, Java, JavaScript, VB o.ä.).
Deutsch beherrschst Du auf C1-Niveau und Englisch auf B2-Niveau.
Du hast Freude an der Zusammenarbeit und Kommunikation im Team.
Deine Benefits
Willkommen im Team
 Damit Du von Beginn an voll bei uns durchstarten kannst, begleiten wir Dich mit strukturierten Onboarding-Maßnahmen während der gesamten Orientierungsphase. Zudem fördert Deine Führungskraft gezielt Deine fachliche und persönliche Integration ins Team.
Vielfältige Karriereperspektiven
 Wir legen Wert auf die individuelle Entwicklung Deiner fachlichen und persönlichen Stärken: Deine eigenen Ambitionen reflektieren wir in strukturierten Entwicklungsgesprächen. Systematische und regelmäßige Feedback-Gespräche unterstützen Dich beim Erreichen dieser Ziele. Als Teil des weltweiten KPMG-.Netzwerks bieten wir Dir interessante Karrieremöglichkeiten im In- und Ausland und somit wertvolle Einblicke in die Vielfalt unserer Tätigkeitsbereiche.
Vereinbarkeit von Beruf und Privatleben
 Wir sind überzeugt, dass es vor allem Vielfalt und Flexibilität braucht, um Innovationen zu fördern und langfristige Erfolge zu sichern. Nur so können wir die besten Ideen entwickeln und wirklich innovative Lösungen finden. Mit flexiblen Arbeitszeiten, Homeoffice-Option, Zeitkonten und Auszeiten schaffen wir Räume, um Privat- und Berufsleben miteinander zu vereinbaren. Darüber hinaus unterstützen wir Dich monatlich mit bis zu vier Stunden Freistellung für Dein soziales Engagement.
Fort- & Weiterbildung
 Durch regelmäßige Trainings, Workshops und Weiterbildungen entwickelst Du Dich stetig weiter. Zudem fördern wir Berufsexamina sowie berufsbegleitende Master-Studiengänge. Mit unseren Rotationsprogrammen ermöglichen wir Deinen fachübergreifenden Einsatz. Diese Einblicke in die vielfältigen Aufgabenfelder bei KPMG erweitern Deinen Horizont und fördern Synergien in der Zusammenarbeit.
Die abgebildeten Leistungen können je nach Position und Standort leicht variieren.";5.0;Ich habe Kenntnisse in Python, was für die RPA-Entwicklung nützlich sein könnte. Allerdings habe ich keine Erfahrung mit spezifischen RPA-Software wie Blue Prism oder UiPath. Zudem habe ich nur oberflächliche Kenntnisse in Programmiersprachen wie C++ und habe keine Erfahrung mit C#, Java oder ähnlichen Sprachen. Auch habe ich keine Erfahrung in der Etablierung eines Application Lifecycle Managements. Dennoch habe ich ein grundlegendes Interesse an Prozessoptimierungen und wäre bereit, mich in diese Themen einzuarbeiten.
3751709773;Almato AG;Softwareentwickler / Microsoft Power Platform-Entwickler (all genders);Entry level;Full-time;Engineering and Information Technology;Information Technology & Services;"Aufgaben
Du unterstützt bei der Identifikation, Analyse und Konzeption von Digitalisierungs- und Optimierungspotenzialen von Unternehmensprozessen unserer Kunden
Analyse, Architektur, Design, Implementierung, Test und Wartung – du übernimmst Aufgaben über den gesamten Power Platform Application-Livecycle
Die Entwicklung und Realisierung von anspruchsvollen Microsoft Power -Softwarelösungen mittels Power Automate, Power Apps, Power Bi und Power Virtual Agents. 
Du arbeitest nach agilen Vorgehensmethoden als Teil unseres interdisziplinären Teams
Mithilfe deines Know-hows entwickelst du in enger Zusammenarbeit mit unseren Kunden und internationalen Partnerfirmen individuelle Lösungsszenarien
Skills
Du besitzt Kenntnisse einer objektorientierten Programmiersprache (Java oder C# bevorzugt) sowie in der Webprogrammierung (HTML, CSS, Javascript)
Mit deiner Konzeptionsstärke und deinem Technologieverständnis begeisterst du unsere Kunden
Du überzeugst uns zusätzlich mit ersten Erfahrungen beim Programmieren von Digitalisierungslösungen auf Basis von Power Automate, Power Apps, Power Bi und Power Virtual Agents
Du verfügst über Kenntnisse in der Identifikation und Gestaltung von Potenzialen zu Prozessoptimierung und Automation
Deine Deutschkenntnisse sind sehr gut
Was wir bieten
Mobiles Arbeiten möglich
Flexible Arbeitszeiten
Spannende und innovative Projekte für namhafte Kunden
Unbefristete Festanstellung in Teil- oder Vollzeit
Mentoring-Programm
Sport- und Freizeitangebote
Offene und agile Arbeitsweise
Deutschland-Ticket für 34,30€ monatlich 
Büros in zentraler Lage mit sehr guter Anbindung an ÖPNV
Förderung deiner persönlichen und fachlichen Entwicklung
Tolles und motiviertes Expertenteam
Moderne, individuelle IT-Ausstattung (PC/Mac etc.)
Coole Firmen- und Mitarbeiterevents (Almato DevCon, Sommerfest etc.)
JobRad (Fahrradleasing für Arbeitnehmer)
Teilnahme am Corporate Benefits Programm
Tischkicker und Dart, je nach Standort
Selbstverständlich für uns:
30 Tage Urlaub
Cafeteria mit kostenlosen Getränken
Weiterbildung
Zeit mit den besten Kollegen für eine Runde Tischkicker";5.0;Based on the information provided in your CV, you have experience in software development and some programming languages, which are relevant for the job description. However, you don't have specific experience with the Microsoft Power Platform or the mentioned software solutions (Power Automate, Power Apps, Power Bi, Power Virtual Agents). Additionally, your knowledge of object-oriented programming languages is not mentioned in your CV. Therefore, while you have some relevant skills, there are specific requirements for this job that you may not meet. It would be beneficial to gain more experience or knowledge in the Power Platform before applying.
3808862371;join.com;Softwareentwickler (m/w/d) at Supremum Marketing GmbH;Entry level;Full-time;Information Technology;Administrative and Support Services;"Du hast Lust auf neue Herausforderungen und die Softwareentwicklung ist deine Leidenschaft? Dann bist Du hier genau richtig!
Die Supremum Gruppe (Supremum Investments GmbH und Supremum Marketing GmbH) ist eine zukunftsorientierte Fondsboutique und Fondsvermarktung mit Schwerpunkt auf computergestützte Anlage-Strategien im Herzen von Frankfurt am Main. Der Schwerpunkt liegt dabei auf dem Publikumsfonds Supremum Fonds.
Wir sind ein junges, schnell wachsendes Unternehmen und freuen uns, wenn du dich bei uns bewirbst als:
Softwareentwickler (m/w/d)
Aufgaben
Wir suchen nach einem Softwareentwickler, um funktionale Programme zu erstellen und zu implementieren. In dieser Rolle solltest du ein Teamplayer mit einem guten Auge für das Detail sein und Problemlösungsfähigkeiten haben.
Zusammenarbeit mit Entwicklern, aber auch selbstständiges Arbeiten, um Algorithmen zu gestalten
Erstellung von sauberem, effizientem Code basierend auf Spezifikationen
Integration von Softwarekomponenten und Programmen von Drittanbietern
Datenanalyse und Aufsetzen eines Frameworks für Backtestings
Verifizierung und Bereitstellung von Programmen und Systemen
Fehlerbehebung, Debuggen und Aktualisieren von bestehender Software
Empfehlung und Ausführung von Verbesserungen
Erstellung der technischen Dokumentation zu Referenz- und Berichterstattungszwecken
Qualifikation
Du hast nachgewiesene Berufserfahrung als Softwareentwickler, Software-Ingenieur oder aus einem ähnlichen Bereich. 
Du bringt bereits Erfahrung mit Softwaredesign und -entwicklung in einer testgetriebenen Umgebung mit. 
Zudem verfügst du über sehr gute Kenntnisse der Programmiersprache Python. Zusätzliche Kenntnisse wie z.B. C++, Java, JavaScript sind wünschenswert. 
Du hast sehr gute Kenntnisse im Umgang mit Microsoft Excel und der Aufbereitung von Daten. 
Darüber hinaus bringst du Erfahrung mit Linux-basierten Servern sowie dem Aufsetzen solcher Systeme und Kenntnisse im Umgang mit Datenbanken mit. 
Du hast Lust darauf, dich weiterzuentwickeln und auch neue Sprachen sowie Technologien zu erlernen. 
Du begeisterst außerdem mit ausgezeichneten Kommunikationsfähigkeiten, Einfallsreichtum und der Einstellung, Fehler unbedingt beheben zu wollen. 
Dabei besitzt du Detailtreue und hohe Genauigkeit. 
Benefits
Du hast die Möglichkeit, zu 100% im Home-Office tätig zu sein und damit maximale Flexibilität für deinen Alltag sowie eine hohe Work-Life-Balance
Wir bieten dir eine langfristige Perspektive in einem modernen, innovativen Unternehmen
Dich erwartet ein junges, kleines, dynamisches Team mit herzlichem Umgang und einem tollen Spirit – Wertschätzung schreiben wir groß!
Offene und direkte Kommunikation
Du musst dich nicht mit ellenlangen Entscheidungsprozessen herumschlagen - flache Hierarchien und kurze Entscheidungswege machen es möglich!
Bei uns hast du immer die Chance auf spannende sowie fordernde Aufgaben mit viel Abwechslung
Wir freuen uns über deine Bewerbung!";5.0;Ich habe Erfahrung als Softwareentwickler und gute Kenntnisse in Python. Allerdings habe ich keine Erfahrung mit Softwaredesign und -entwicklung in einer testgetriebenen Umgebung. Zudem habe ich keine Erfahrung mit Linux-basierten Servern und dem Aufsetzen solcher Systeme. Außerdem habe ich keine Erfahrung im Umgang mit Datenbanken. Es könnte herausfordernd sein, mich in diese spezifischen Anforderungen einzuarbeiten. Dennoch habe ich Lust mich weiterzuentwickeln und neue Sprachen und Technologien zu lernen.
3750064487;Workwise;Projektingenieur - Kundenservice / Administration / Beratung / Konzeption (m/w/d);Entry level;Full-time;Engineering and Information Technology;IT Services and IT Consulting and Software Development;"Über Innoface AG
Unsere Schnittstellen koppeln das weltweit verbreitete PTC Windchill mit wichtigen ERP-Systemen wie SAP, S/4HANA, Microsoft D365 und weiteren. Dabei werden die gängigen und aktuellen Technologien und Programmiersprachen eingesetzt. So besteht die Möglichkeit, sich weiter zu qualifizieren und den eigenen Marktwert erheblich zu steigern.
Was bieten wir Dir?
Flexible Arbeitszeiten, sowie die Möglichkeit zum mobilen Arbeiten (bis zu 3 Tage Home Office/Woche)
30 Tage Urlaub für eine ausgewogene Work-Life-Balance
Weiterbildung ist für uns von großer Bedeutung und wir fördern unsere Mitarbeiter dementsprechend individuell und auf ihre Bedürfnisse abgestimmt
Zentrale Lage in Karlsruhe, gut mit dem öffentlichen Nahverkehr (Haltestelle Europahalle/ZKM), Auto (mit Parkmöglichkeit) oder Fahrrad zu erreichen
Regelmäßige Betriebsausflüge, bei denen man sich näher kennenlernen und austauschen kann
Attraktive Angebote zur betrieblichen Altersvorsorge sowie die Möglichkeit zu einer Zusatz-BKV
Kostenlos frisches Obst, Säfte, Kaffee vor Ort bei uns im Büro
Jobrad sowie Mitarbeiter MEINMPP für das Leasing von Hardware
Eine abwechslungsreiche und verantwortungsvolle Tätigkeit, in der Du mit den neuesten Technologien arbeitest
Gemeinsam als Team lernen wir täglich neu und entwickeln unser Know-How in allen Unternehmensbereichen weiter
Was erwartet Dich?
Spannende Projekte rund um unsere Schnittstelle zur Kopplung des PLM-Systems PTC Windchill mit diversen ERP-Systemen wie SAP, S/4HANA, Microsoft D365, NAV, Oracle und vielen weiteren.
Zu Deinen Aufgaben zählt die Mitarbeit bei nationalen und internationalen Kundenprojekten, von der Konzeption bis zum Go-Live
Du installierst die Schnittstelle und setzt durch Konfiguration bzw. Customizing die Anforderungen der Kunden um
Du stimmst Dich eng mit Kunden und anderen beteiligten Projektteilnehmern ab und arbeitest mit bei der Produktivsetzung
Du übernimmst die Verantwortung zur Umsetzung ganzer Arbeitspakete und sicherst durch geeignete Tests die Funktionsfähigkeit der Schnittstellen ab
Du nimmst bei Bedarf Supportaufgaben wahr und unterstützt unsere Kunden auch noch nach dem Go-Live mit Deinem fundierten Know-How
Was solltest Du mitbringen?
Du verfügst über Erfahrungen basierend auf einem Studium der Fachrichtung (Wirtschafts-) Informatik, einer Ausbildung als Fachinformatiker für Anwendungsentwicklung oder einem vergleichbaren Abschluss
Du hast Erfahrung in der Anwendung einer Programmiersprache, idealerweise Java und ein Grundwissen über IT-Netzwerke, Technologien und die gängigen Entwicklertools
Du bringst idealerweise Kenntnisse im PLM-System PTC Windchill und in einem ERP-System wie bspw. SAP, S/4HANA, Microsoft D365, NAV oder Oracle mit
Du bist optimalerweise mit Jira, Confluence und weiteren Anwendungen aus der Atlassian Welt vertraut
Du bringst verhandlungssichere Deutsch- und Englischkenntnisse mit
Unser Jobangebot Projektingenieur - Kundenservice / Administration / Beratung / Konzeption (m/w/d) klingt vielversprechend?
Bei unserem Partner 
Campusjäger by Workwise
 ist eine Bewerbung für diesen Job 
in nur wenigen Minuten
 und 
ohne Anschreiben
 möglich. Anschließend kann der Status der Bewerbung live verfolgt werden. Wir freuen wir uns auf eine 
Bewerbung über Campusjäger by Workwise
.
Mehr Informationen zu uns und unseren Jobangeboten findet man auf unserem Unternehmensprofil bei Campusjäger by Workwise.";5.0;Basierend auf deiner Vita, hast du einige relevante Kenntnisse und Erfahrungen, die für den Job als Projektingenieur - Kundenservice / Administration / Beratung / Konzeption passen könnten. Du hast Erfahrung in der Softwareentwicklung und hast mit verschiedenen Programmiersprachen gearbeitet, darunter auch Python und C++. Es ist jedoch unklar, ob du Erfahrung mit Java hast, was eine Anforderung in der Stellenbeschreibung ist. Außerdem wird Kenntnis im PLM-System PTC Windchill und in einem ERP-System wie SAP, S/4HANA, Microsoft D365, NAV oder Oracle gefordert, von denen du in deiner Vita keine Erfahrung erwähnst. Es könnte daher hilfreich sein, etwas mehr über deine Kenntnisse in diesen Bereichen zu erfahren, um eine genauere Bewertung abgeben zu können.
3803111595;DIS AG;Softwareentwickler (m/w/d) - Hybridanteil;Entry level;Full-time;Engineering and Information Technology;Human Resources Services;"Sie verbinden Motivation mit Expertise und sind der Fachexperte (m/w/d) in IT-Fragen? Sie suchen nach einer neuen Herausforderung im Berufsleben und glänzen mit Persönlichkeit und Leidenschaft für Ihren Job? Wir als DIS AG suchen Sie als Experte (m/w/d) in der Entwicklung im Raum Karlsruhe!
Ihre Aufgaben
Entwickeln in den Programmiersprachen Java / C# Backend- und Frontend-Komponenten
Nutzung von moderne Frameworks und Tools wie z.B. Spring (Java), Git, Maven und Jenkins
Implementierung von Anforderungsspezifikationen, neuen Features sowie Bugfixes
Begleitung von Software-Tests und Produkt-Releases
Fachübergreifende Zusammenarbeit in agilen und crossfunktionalen Teams
Ihr Profil
Hochschulabschluss in der Informatik, Wirtschaftsinformatik oder einem vergleichbare Abschluss
Fundierte Kenntnisse in Microsoft Dynamics NAV und idealerweise mehrjährige Erfahrungen in Programmiersprache C# 
Berufsrelevantes Studium oder eine Ausbildung abgeschlossen oder eine vergleichbare passende Qualifikation
Idealerweise Erfahrung in der Softwareentwicklung in Java und / oder C# sowie den entsprechenden Frameworks (z. B. WPF (C# .NET), Spring (Java))
Wünschenswert sind zusätzliche Kenntnisse im Umgang mit Datenbanken (z. B. MSSQL, Oracle) und deren Programmierung
Sehr gute Deutschkenntnisse in Wort und Schrift sowie gute Englischkenntnisse
Ihre Benefits
Unbefristeter Arbeitsvertrag
Ein monatliches Festgehalt bei übertariflicher Bezahlung
Vermögenswirksame Leistungen
Urlaubs- und Weihnachtsgeld
Flexible Arbeitszeiten/ Homeoffice
Sicherer Arbeitsplatz
…und vieles mehr
Bei uns wird Ihr Berufsweg zum persönlichen Walk of Fame – wir bieten Ihnen spannende Perspektiven in den Bereichen Assistenz & Sekretariat, Marketing, Vertrieb, HR sowie Einkauf & Logistik. Jetzt auf ""direkt bewerben"" klicken!
Dein Kontakt
Frau Janin Fuchs
it-karlsruhe@dis-ag.com
DIS AG
IT
Frühlingstraße 10
76131 Karlsruhe
Telefon: +49 0721 9335841";5.0;Obwohl ich Erfahrung in der Softwareentwicklung habe und auch einige der geforderten Programmiersprachen wie Java und C# beherrsche, fehlt mir spezifische Erfahrung mit Microsoft Dynamics NAV und der Programmiersprache C#. Auch verfüge ich nicht über Erfahrung mit Datenbanken wie MSSQL oder Oracle. Daher würde ich mich nur mit einer mittleren Bewertung bewerben.
3798615690;Bosch;Softwareentwickler und -integrator AUTOSAR Classic Platform (w/m/div.) - anteilig remote;Associate;Full-time;Information Technology;Software Development;"Unternehmensbeschreibung
Von Embedded Systems über Cloud Computing bis zu Künstlicher Intelligenz – ITK Engineering bietet als international tätiges Technologieunternehmen plattformunabhängige Software- und Systementwicklung und umfangreiche Methodenexpertise. Mit rund 1.300 Mitarbeitenden ist das Unternehmen Innovationstreiber im Bereich Digital Engineering und seit 2017 eine hundertprozentige Tochtergesellschaft der Robert Bosch GmbH. 
Angetrieben von unserer Begeisterung für Technik gestalten wir gemeinsam die digitale Welt von morgen und lassen Visionen zur Wirklichkeit werden. Werde auch Du ein Teil davon!
Bewirb Dich jetzt bei der ITK Engineering GmbH und freue Dich auf spannende Herausforderungen und ein inspirierendes Arbeitsumfeld.
Stellenbeschreibung
Du übernimmst abwechslungsreiche Entwicklungstätigkeiten in unserer vielfältigen Projektlandschaft, wie z.B. Konfiguration der BSW mit den gängigsten Werkzeugen, Treiberentwicklung auf MCAL-Ebene, CDD-Entwicklung im Kontext Vehicle Computer. 
Zu Deinem Aufgabenbereich gehört die Erstellung und Analyse von Embedded Softwarearchitekturen. 
Du designst und analysierst Scheduling-Konzepte für Echtzeitbetriebsysteme. 
Du kümmerst dich um die Umsetzung von der Software-Over-The-Air Funktionalität für Embedded Systeme. 
Du betreust die Integration kundenspezifischer Anwendungen und Flashbootloadern. 
Du berätst unsere Kunden zu den neuesten Technologien und Entwicklungen rund um AUTOSAR. 
Du übernimmst Projektverantwortung bei entsprechender Erfahrung bzw. Qualifikation durch ITK. 
Qualifikationen
Persönlichkeit und Arbeitsweise: Selbständige und strukturierte Arbeitsweise sowie hohes Qualitätsbewusstsein und Teamgeist
Erfahrung und Know-How: Berufserfahrung in der Entwicklung von Embedded Software oder Applikationen im AUTOSAR-Kontext oder der Konfiguration von Modulen der Basissoftware wünschenswert, Erfahrung mit mindestens einer gängigen AUTOSAR-Toolkette und Mikrocontroller (Kenntnisse sind von Vorteil), fundierte Kenntnisse der Programmiersprache C und automotiver Bussysteme wie Ethernet, CAN(-FD), LIN oder FlexRay, praktische Erfahrung mit im Automotive-Bereich gängigen Entwicklungs- und Parametrierwerkzeugen (z.B. Vector CANoe)
Ausbildung: Erfolgreich absolviertes Studium der Elektrotechnik, technischen Informatik oder vergleichbarer Abschluss (Diplom oder Master)
Sprachen: Verhandlungssicheres Deutsch und gutes Englisch (mündlich und schriftlich)
Zusätzliche Informationen
Wir, die ITK Engineering GmbH, ermöglichen Dir berufliche Flexibilität. Sprich uns in einem ersten Kennenlerngespräch gerne auf die Möglichkeiten des flexiblen und mobilen Arbeitens an.
Die Unterschiedlichkeit unserer Mitarbeitenden ist uns wichtig und wir fördern ein diverses Arbeitsumfeld. Zu unserem ITK-Alltag gehören außerdem der Austausch auf Augenhöhe, stetiges Lernen und eine große Portion Teamspirit. Finde mehr heraus über unsere Benefits sowie die ITK Kultur.
Du hast Fragen am Bewerbungsprozess?
Hatice Kürtül
+49 (0)7272-7703-3333";5.0;Based on your experience in software development and your knowledge of programming languages like Python and C++, you have some relevant skills for the job as a software developer. However, your experience with AUTOSAR, which is mentioned in the job description, is not mentioned in your profile. Additionally, your knowledge of embedded systems and microcontrollers is not specified. So while you have a solid foundation, there are some gaps in your skills and experience that might make you a decent fit for the job, but not a perfect one.
3791032277;Workwise;Fullstack Software Engineer - Angular / Cloud Computing / Objektorientierte Programmierung (m/w/d);Entry level;Full-time;Engineering and Information Technology;IT Services and IT Consulting and Software Development;"Über Axio Concept GmbH
Suchst du nach einer Karriere, die nicht nur befriedigend, sondern auch zukunftsorientiert ist? Du bist am richtigen Ort. Bei axio glauben wir, dass unsere Zukunft in der Künstlichen Intelligenz und Digitalisierung liegt. Wir sind davon überzeugt, dass diese Technologien die Welt zum Besseren verändern können - und du kannst ein Teil davon sein.
Was bieten wir dir?
Sehr gute Work-Life-Balance und 30 Tage Urlaub
Hoher Remote-Office-Anteil möglich
Gute Standortanbindung an öffentliche Verkehrsmittel und Autobahn
Klimatisierte Büros und kostenfreier Kaffee, Tee & Wasser vor Ort
Vertrauensarbeitszeit und Gleitzeitkonto
Bezahlte Weiterbildungen und Zertifikate
Zeit für persönliche Weiterentwicklung und Community/Research-Projekte nach Absprache
Was erwartet dich?
Du berätst unsere Kunden und entwickelst maßgeschneiderte Softwarelösungen
Du gestaltest aktiv unsere Produktentwicklung mit
Du setzt deine Expertise und Kreativität ein, um heutige Herausforderungen in morgige Lösungen zu verwandeln
Was solltest du mitbringen?
Du sprichst fließend Deutsch
Du bist erfahren in sowohl Front-End- als auch Back-End-Entwicklung
Du hast einen besonderen Fokus auf Angular, Cloud Computing (Azure, AWS), C# oder Java, Datenbanken und Service-Architekturen
Du bist offen für Neues, ein Teamplayer und hast Interesse daran, neue Technologien zu erforschen und dich regelmäßig weiterzubilden
Du hast solide Kenntnisse in einer objektorientierten Programmiersprache und Erfahrung in der Webentwicklung mit einem SPA-Webframework
Unser Jobangebot Fullstack Software Engineer - Angular / Cloud Computing / Objektorientierte Programmierung (m/w/d) klingt vielversprechend?
Bei unserem Partner 
Campusjäger by Workwise
 ist eine Bewerbung für diesen Job 
in nur wenigen Minuten
 und 
ohne Anschreiben
 möglich. Anschließend kann der Status der Bewerbung live verfolgt werden. Wir freuen wir uns auf eine 
Bewerbung über Campusjäger by Workwise
.
Mehr Informationen zu uns und unseren Jobangeboten findet man auf unserem Unternehmensprofil bei Campusjäger by Workwise.";5.0;Die Stellenbeschreibung sucht jemanden, der sowohl Front-End- als auch Back-End-Entwicklung beherrscht und Erfahrung mit Angular, Cloud Computing, C# oder Java, Datenbanken und Service-Architekturen hat. Obwohl ich Erfahrung mit Softwareentwicklung habe und Python und C++ kenne, fehlt mir die Erfahrung mit den spezifischen Technologien in der Stellenbeschreibung. Ich könnte mich zwar in neue Technologien einarbeiten, aber mein aktuelles Wissen und meine Erfahrungen passen nicht genau zur Stellenbeschreibung. Daher ist meine Bewertung bei 5.
