jobid;company;job-title;Seniority level;Employment type;Job function;Industries;description;ranking;explanation
3800025543;Kenbun IT AG;AI Engineer (w/m/d) - Karlsruhe / Stuttgart / München / remote;Entry level;Full-time;Information Technology;IT Services and IT Consulting;"Wir sind ein Startup für Künstliche Intelligenz aus Karlsruhe,
das als smarter Innovationstreiber die digital-intelligente Welt von
morgen mitgestaltet.
Die KENBUN IT AG bringt State-of-the-Art KI-Technologien zur Produktreife und macht ihre
Kunden fit für die digitale Transformation. Dazu setzen wir auf Voice Technologie, wie z.B. unser natürlichsprachliches Assistenzsystem KIDOU und auf zukunftssichere Big Data Lösungen, wie unsere hochskalierbare KI-und Big Data-Plattform KIDAN.
Wir unterstützen unsere Partner auch bei der Umsetzung von innovativen Projekten im Bereich Künstliche Intelligenz und Big Data. Wir forschen an Machine Learning und Deep Learning zur Spracherkennung und sind an mehreren BMWK und BMBF Forschungsprojekten beteiligt.
Bei KENBUN arbeiten wir nicht nur in Projekten agil. Agile
ist in unserer DNA verankert. Eigeninitiative und Verantwortungsbereitschaft
leben wir.
Willst auch Du Teil des Projektes Zukunft werden? Dann
bewirb Dich jetzt!
Aufgaben
Konzeption und Entwicklung unserer AI-Produkte 
Entwicklung von Cloud- und On-Premise Softwaresystemen im Themenbereich Artificial
Intelligence 
Auswahl und Training von Deep Learning Modellen zur Spracherkennung und Sprachsynthese 
Entwicklung von Algorithmen zur Spracherkennung und Textverarbeitung 
Überführung der Modelle in performante, produktionsreife Softwaresysteme 
Zusammenarbeit mit Kunden bei der Lösungserstellung 
Präsentation und Kommunikation unserer Lösungen im ML-Umfeld 
Durchführung von Design- und Code-Reviews
Qualifikation
Studium mit IT-Hintergrund bzw. Mathematik / Physik oder eine vergleichbare Ausbildung 
Erfahrungen mit AI-Technologien, z.B. PyTorch und Tensorflow 
Erfahrung in Python und mindestens einer weiteren Programmiersprache wie z.B. Rust, C++
oder Java 
Kenntnisse von Methoden der Softwareentwicklung 
Fundiertes mathematisches, algorithmisches Verständnis 
Kenntnisse von gängigen Cloud-Plattformen und -Technologien von Vorteil 
Selbständiges, zielorientiertes und methodisches Vorgehen 
Hohes Maß an Eigeninitiative 
Kommunikations- und Teamfähigkeit 
Sehr gute Deutsch- und Englischkenntnisse in Wort und Schrift runden Dein Profil ab 
In unserem kollegial geführten Unternehmen beteiligen wir unser Team an Entscheidungsprozessen. Wir leben eine wertschätzende Feedbackkultur und erwarten und fördern Eigeninitiative sowie Verantwortungsbereit-schaft zur Erreichung nachhaltiger Unternehmenstätigkeit.
Benefits
Anspruchsvolle konzeptionelle Themen, wie State-of-the-Art ML Modelle
Übernahme von Verantwortung und viel Raum für Kreativität in einem vielseitigen Aufgabengebiet
Unterstützung bei der Entfaltung Deines Potenzials durch individuelle Förderung
Kompetente, individuelle Betreuung während der Einarbeitungsphase für einen einfachen Start in den neuen Job
Exzellente Arbeitsatmosphäre in einem hochmotivierten Team mit Top Arbeits- und Büroausstattung
Freie Wahl des Betriebssystems und Entwicklungsumgebung
Flexible Arbeitszeiten und Homeoffice Regelung
Vereinbarkeit von Familie und Beruf, z.B. Kinderbetreuung
Unterstützung beim Umzug, z.B. Wohnungssuche, Übernahme der Transportkosten
Partizipieren am Unternehmenserfolg eines dynamisch wachsenden Startups
Work-Life-Balance, z.B. Sabbatical, Gesundheits- und Fitnessförderung
Viel Freiraum und Möglichkeiten beim Aufbau des Unternehmens
Und im Übrigen… 31 Tage Urlaub
Bewirb Dich jetzt mit Anschreiben, Lebenslauf als PDF, Gehaltsvorstellung und gewünschtem Eintrittsdatum.
Wir freuen uns auf Dich!
Stellen-ID: 209KAE";8.0;Ich würde mich auf jeden Fall für diesen Job bewerben, da er gut zu meinen Fähigkeiten und Interessen passt. Ich habe Erfahrungen mit Python und C++, was in der Stellenbeschreibung gefragt ist. Ich habe auch Kenntnisse in AI-Technologien wie PyTorch und Tensorflow, was ein großer Vorteil ist. Obwohl meine Erfahrung mit Rust und Java begrenzt ist, denke ich, dass ich in der Lage wäre, mich schnell einzuarbeiten. Meine Kenntnisse in Methoden der Softwareentwicklung und mein mathematisches Verständnis sind ebenfalls von Vorteil. Ich bin bereit, Verantwortung zu übernehmen und selbstständig zu arbeiten. Meine Deutsch- und Englischkenntnisse sind ebenfalls gut, was in dieser Position gefordert wird. Alles in allem denke ich, dass ich gut zum AI Engineer-Job bei Kenbun IT AG passe.
3802694933;Smart Host;Sales Manager (m/w/d) - Remote von Deutschland / Österreich;Entry level;Full-time;Sales;IT Services and IT Consulting;"Smart Host ist ein junges B2B Softwareunternehmen im Hotellerie-Bereich. Wir haben eines der weltweit innovativsten CRM Systeme für Hotels entwickelt und revolutionieren damit die Hotel-Gast-Interaktion. Datensegmentierung, maschinelles Lernen, künstliche Intelligenz und personalisierte Kommunikation: Wir sorgen dafür, dass Hotels Ihre Gäste besser kennen, zielgerichteter mit Ihnen kommunizieren und mehr Buchungen und Umsatz generieren.
Als Sales Manager wirst Du Teil unseres über den D-A-CH Markt herauswachsenden Vertriebsteams. Der ideale Kandidat ist ehrgeizig, hartnäckig und begeistert davon, die Hotelbranche durch innovative Technologien zu verändern. Wir wählen gemeinsam vielversprechende Leads aus, welche Du kontaktierst und zu einer Produktpräsentation einlädst. Du verhandelst Verträge und stellst nach Vertragsabschluss sicher, dass unsere Kunden zu aktiven Smart Host Botschaftern werden.
Aufgaben
Du akquirierst regelmäßig neue Leads und begleitest potentielle Kunden bis zum erfolgreichen Vertragsabschluss
Du bist in ständigem Kontakt mit potentiellen Kunden und analysierst dabei interne Prozesse und individuelle Bedürfnisse der möglichen Kunden
Du präsentierst und repräsentierst Smart Host gegenüber Kunden in Terminen vor Ort und online
Du identifizierst die Schlüsselregionen um die von unserem CSO festgelegten Ziele zu erreichen
Du hilfst mit Kundenfeedback unser Produkt weiter zu entwickeln und erkennst Umsatzmöglichkeiten
Du bist maßgeblich am Ausbau und der Strukturierung des Sales-Prozesses beteiligt
Qualifikation
Du sprichst fließend deutsch und englisch
Du bist Kontaktfreudig und bereit mit Mitarbeitern, Kunden und Partnern in verschiedenen Ländern und auf verschiedenen Organisationsebenen zu kommunizieren
Du hast bereits Erfahrung im B2B SaaS-Vertrieb oder hattest eine frühere Tätigkeit im Hotel/Hostel-Vertrieb oder im Vertrieb von Hospitality-Software
Erfahrung im Hotelgewerbe wird bevorzugt, ist aber nicht zwingend erforderlich
Du vereinst Begeisterungsfähigkeit, Professionalität und Fingerspitzengefühl in Verhandlungen mit unternehmerischem Denken
Du überzeugst und berätst Deine Kunden mit Leidenschaft
Du bist hoch motiviert, strukturiert und organisiert und hast die Fähigkeit Feedback anzunehmen, schnell zu lernen und Dich an neue Situationen anzupassen
Du verwaltest deine Aktivitäten übersichtlich und gewissenhaft in unserem CRM
Du hast eine hohe Reisebereitschaft
Benefits
Du erhältst die einmalige Chance, den Aufbau eines Unternehmens und dessen Internationalisierung zu begleiten und mitzugestalten
Entwicklungsmöglichkeiten als Teil eines rapide wachsenden Unternehmens
Ein internationales Umfeld: Sowohl unser Team (10+ Nationalitäten) als auch unsere Kunden
Offene, schnelle und leistungsorientierte Unternehmenskultur mit flachen Hierarchien
Regelmäßige Team- und Firmenevents
Attraktive Entlohnung, faires Kommissionsmodell
Deine Bewerbung sollte einen aktuellen Lebenslauf, ein Motivationsschreiben und dein gewünschtes Startdatum enthalten.";7.0;Based on my experience with machine learning and my interest in innovative technologies, I believe I would be a good fit for the Sales Manager role at Smart Host. While I don't have specific experience in B2B SaaS sales or the hotel industry, my technical background and ability to quickly adapt to new situations would allow me to effectively communicate the benefits of Smart Host's CRM system to potential customers. Additionally, my fluency in both German and English would be an asset in communicating with clients from different countries. However, I would need to learn more about the specific requirements and expectations of the role before making a final decision on whether to apply.
3791029868;Workwise;Fullstack Software Engineer - Angular / Cloud Computing / Objektorientierte Programmierung (m/w/d);Entry level;Full-time;Engineering and Information Technology;IT Services and IT Consulting and Software Development;"Über Axio Concept GmbH
Suchst du nach einer Karriere, die nicht nur befriedigend, sondern auch zukunftsorientiert ist? Du bist am richtigen Ort. Bei axio glauben wir, dass unsere Zukunft in der Künstlichen Intelligenz und Digitalisierung liegt. Wir sind davon überzeugt, dass diese Technologien die Welt zum Besseren verändern können - und du kannst ein Teil davon sein.
Was bieten wir dir?
Sehr gute Work-Life-Balance und 30 Tage Urlaub
Hoher Remote-Office-Anteil möglich
Gute Standortanbindung an öffentliche Verkehrsmittel und Autobahn
Klimatisierte Büros und kostenfreier Kaffee, Tee & Wasser vor Ort
Vertrauensarbeitszeit und Gleitzeitkonto
Bezahlte Weiterbildungen und Zertifikate
Zeit für persönliche Weiterentwicklung und Community/Research-Projekte nach Absprache
Was erwartet dich?
Du berätst unsere Kunden und entwickelst maßgeschneiderte Softwarelösungen
Du gestaltest aktiv unsere Produktentwicklung mit
Du setzt deine Expertise und Kreativität ein, um heutige Herausforderungen in morgige Lösungen zu verwandeln
Was solltest du mitbringen?
Du sprichst fließend Deutsch
Du bist erfahren in sowohl Front-End- als auch Back-End-Entwicklung
Du hast einen besonderen Fokus auf Angular, Cloud Computing (Azure, AWS), C# oder Java, Datenbanken und Service-Architekturen
Du bist offen für Neues, ein Teamplayer und hast Interesse daran, neue Technologien zu erforschen und dich regelmäßig weiterzubilden
Du hast solide Kenntnisse in einer objektorientierten Programmiersprache und Erfahrung in der Webentwicklung mit einem SPA-Webframework
Unser Jobangebot Fullstack Software Engineer - Angular / Cloud Computing / Objektorientierte Programmierung (m/w/d) klingt vielversprechend?
Bei unserem Partner 
Campusjäger by Workwise
 ist eine Bewerbung für diesen Job 
in nur wenigen Minuten
 und 
ohne Anschreiben
 möglich. Anschließend kann der Status der Bewerbung live verfolgt werden. Wir freuen wir uns auf eine 
Bewerbung über Campusjäger by Workwise
.
Mehr Informationen zu uns und unseren Jobangeboten findet man auf unserem Unternehmensprofil bei Campusjäger by Workwise.";7.0;Die Stellenbeschreibung passt größtenteils gut zu meiner Vita. Ich habe Erfahrung in der Softwareentwicklung, insbesondere im Bereich der Webentwicklung. Ich habe solide Kenntnisse in einer objektorientierten Programmiersprache und habe mit SPA-Webframeworks gearbeitet. Ich bin auch offen für neue Technologien und kontinuierliche Weiterbildung. Obwohl ich keine spezifische Erfahrung mit Angular und Cloud Computing habe, bin ich bereit, mich in diese Bereiche einzuarbeiten. Ich denke, es ist eine vielversprechende Position für mich.
3665708554;Bertrandt Group;Testingenieur Mikro-Positioniersysteme (m/w/d);Entry level;Full-time;Engineering and Information Technology;Construction;"Arbeitsort:
 76133, Karlsruhe
Was Sie erwartet:
Sie sind für die Konzeptionierung, Durchführung, Auswertung und Dokumentation von Testreihen auf System- und Komponentenebene zuständig
Sie führen Entwicklungsbegleitende Untersuchungen und Inbetriebnahmen von Funktionsmustern und Prototypen, sowie die Auswahl geeigneter Methoden, Werkzeuge und Teststrategien durch
Sie wirken bei der Erstellung von Pflichtenheften mit
Sie sind für die Weiterentwicklung von Methoden und Werkzeugen für die Durchführung von Tests, Qualifikationen, die Test-Automatisierung und Auswertung verantwortlich
Zu Ihrem Aufgabengebiet gehören außerdem die technische Beratung des Vertriebs, des Produktmanagement und Produkt-Marketing
Sie begleiten den gesamten Produktentstehungsprozesses bis hin zur Auslieferung 
Sie arbeiten mit anderen Fachbereichen, wie der Entwicklung, dem Produktionsmanagement, dem Industrial Engineering, der Produktion und dem Projektmanagement zusammen
Was Sie mitbringen:
Sie haben ein Fach- oder Hochschulstudium in der Fachrichtung Mechatronik, Maschinenbau, Elektrotechnik oder einem ähnlichen Studiengang erfolgreich abgeschlossen oder besitzen eine Technikerausbildung oder eine abgeschlossene Ausbildung inkl. Berufserfahrung im genannten Bereich
Sie bringen Berufserfahrung im Bereich der Versuchsplanung, Verifizierung und Validierung von Produktmerkmalen mit
Sie besitzen Basiswissen mindestens einer modernen Programmiersprache (Python, Matlab, .NET) und idealerweise Erfahrung im Umgang mit CAD & FEM
Sie haben optimalerweise die Ausbildung zum SixSigma GreenBelt absolviert
Sie verfügen über ein hohes Maß an Teamfähigkeit und eine analytische, zielorientierte und strukturierte Arbeitsweise
Sehr gute Deutsch- und Englischkenntnisse runden Ihr Profil ab
Unsere Stelle spricht Sie fachlich und menschlich an? Dann freuen wir uns auf Ihre Online Bewerbung mit der Angabe Ihrer Gehaltsvorstellung und Ihres möglichen Eintrittstermins.
Was wir können:
 Verantwortungsvolle Aufgaben 
 Patenmodell 
 Konzernweites ""Netzwerken"" 
 Trainingsangebote 
 Rabatte 
 Attraktive Vergütung 
 Sabbatical 
 Betriebliche Altersvorsorge und BU-Versicherung 
Kontakt:
Katharina Poth Tel.: +49 7034 65613844
Kontakt:
Katharina Poth Tel.: +49 7034 65613844 Der Bertrandt-Konzern bietet seit über 40 Jahren Entwicklungslösungen für die internationale Automobil- und Luftfahrtindustrie sowie die Branchen Maschinen- und Anlagenbau, Energie, Medizintechnik und Elektroindustrie in Europa, China und den USA. Insgesamt stehen unsere Mitarbeiterinnen und Mitarbeiter für tiefes Know-how, zukunftsfähige Projektlösungen und hohe Kundenorientierung.
Testingenieur Mikro-Positioniersysteme (m/w/d)
Ort: Karlsruhe";7.0;Based on your experience with machine learning, software development, and your academic background in data science, you have a strong foundation for the job as a Testing Engineer for micro-positioning systems. While you may not have specific experience in mechanical engineering or mechatronics, your knowledge and skills in Python, C++, and ROS could be valuable in conducting tests and developing test automation tools. Additionally, your experience in developing image recognition pipelines and working with robotics interfaces demonstrate your ability to work with complex systems. With some additional knowledge and experience in the specific domain of micro-positioning systems, you could be a strong candidate for this role.
3804302500;USU Solutions DACH;Softwareentwickler (w/d/m) Big Data/ KI;Associate;Full-time;Information Technology and Engineering;IT Services and IT Consulting;"Wir haben spannende Aufgaben für Dich:
Du setzt moderne Technologien und Methoden ein, wie z.B. Python, Scala oder Java, Cloud Computing mit Kubernetes und NoSQL Datenbanken, Continuous Integration, Deployment und DevOps
Du bringst Dein Können und Deine Kreativität in alle Phasen der agilen Softwareentwicklung ein
Du gestaltest und betreibst Lösungen in den Bereichen Big Data, Maschinelles Lernen und Large Language Modells mit nachhaltigem Nutzen für unsere Kunden
Du integrierst deine Software in teamübergreifender Zusammenarbeit mit anderen Entwickler:innen und Produktmanager:innen in ein Gesamtportfolio
Du bist Teil von Forschungsprojekten, um Ideen auszuprobieren und Innovationen zu generieren
Du arbeitest gemeinsam mit Deinen Kolleg:innen in unserem selbstorganisierten, cross-funktionalen agilen Team
Das bringst Du mit:
Du hast ein abgeschlossenes Studium (z.B. Informatik, Wirtschaftsinformatik, Mathematik) oder eine vergleichbare Ausbildung
Du bringst solide Kenntnisse Software-Engineering und Architektur in Python, Scala oder Java mit
Du hast erste Erfahrungen oder Interesse an Container-Lösungen (z.B. Docker, Kubernetes), (No)SQL-Datenbanken und BigData-Technologien
Erfolgreiche Entwicklung von Software schließt für Dich die Bereitstellung einer passenden Umgebung und den Betrieb mit ein
Teamgeist und Begeisterung für die Entwicklung innovativer KI-Anwendungsfälle runden dein Profil ab
Du bringst sehr gute Deutsch- und gute Englischkenntnisse mit
Unsere Benefits:
Individuelle Weiterbildung im Weiterbildungsprogramm U Step Up
Pat:innenprogramm und individueller Einarbeitungsplan für neue Mitarbeitende sowie eine Einführungsveranstaltung
Flexible Arbeitszeiten, Sabbaticals, offene Türen und flache Hierarchien
Firmenfahrzeug auch zur privaten Nutzung
30 Tage Urlaub jährlich + diverse Sonderurlaube
Unterstützung bei der Altersvorsorge und Berufsunfähigkeitsabsicherung
Unfallversicherung
Vergünstigte Mitgliedschaft im Firmenfitness Programm
Prämien für die Werbung neuer Mitarbeitender
Mitarbeitendenrabatte
USU-Bistro mit vergünstigtem Mittagessensangebot
Parkgarage und Ladestationen für Elektrofahrzeuge
Kostenloses Wasser, Kaffee, Tee & Obst
Partnerschaftliches Miteinander";7.0;Du passt gut zur Stellenbeschreibung, da du solide Kenntnisse im Bereich Softwareentwicklung und Architektur mitbringst. Du hast Erfahrung mit Python und hast Interesse an Big Data und maschinellem Lernen. Deine Kenntnisse in Python, C++ und ROS können dir helfen, dich schnell in andere Programmiersprachen einzuarbeiten. Es könnte jedoch von Vorteil sein, wenn du bereits Erfahrungen mit Container-Lösungen und NoSQL-Datenbanken hättest, da dies in der Stellenbeschreibung erwähnt wird.
3683780899;PACE;Golang Developer m/w/d;Entry level;Full-time;Engineering and Information Technology;Technology, Information and Internet;"PACE Telematics mit Sitz in Karlsruhe ist einer der technologisch führenden Anbieter im Bereich Connected Car Services und automotive Cloud Plattformen. Das zentrale Produkt von PACE ist die Plattform connectedfueling.com auf deren Basis mobiles Bezahlen an der Tankstelle mit beliebigen Zahlmethoden möglich ist.
Deine Aufgaben
Du wirst Teil eines Teams in welchem Du Deine Ideen von Anfang an einbringen kannst
Du bist zusammen mit deinem Team für Entwicklung und Testen von Backend Services insbesondere mit Blick auf Hochverfügbarkeit und Skalierbarkeit zuständig
Du begeisterst Dich für Architekturthemen und bringst dein Wissen hierzu im Team ein
Code-Review gehört für Dich dazu
Du evaluierst neue Technologien
Dein Profil
Du hast bereits mit Go gearbeitet oder brennst darauf mit Go zu arbeiten und hast bisher mit einer vergleichbaren Programmiersprache gearbeitet (z.B. Java, Python, Ruby, .. etc.)
Idealerweise hast du Erfahrungen im Bereich Microservice Architektur
Erfahrung mit REST API-Entwicklung
Kenntnisse in Continuous Integration/Deployment
Du hast Spaß daran selbstständig, akkurat und mit „Clean Codes“ zu arbeiten
Versionskontrolle mit Git liegt Dir am Herzen
Du überzeugst außerdem durch Teamfähigkeit, eigenständiges und zielgerichtetes Arbeiten, und verfügst über gute Kommunikationsfähigkeiten
Sehr gute Deutschkenntnisse und eine gute Portion Humor runden Dein Profil ab
Was wir Dir bieten
Direkte Zusammenarbeit mit erfahrenem MD/Founder und flache Hierarchien
Spannendes Arbeitsumfeld in einem motivierten Team
Selbständige Umsetzung deiner Aufgaben
Loftbüro in einer alten Burg in Karlsruhe
30 Tage Urlaub pro Kalenderjahr
Straßenbahnhaltestellen vor der Türe (KVV)
Freie Getränke (Bionade, Club-Mate, Kaffee,..) und Obst im Büro
Regelmäßige Socializing-Events und Spaß bei der Arbeit
Interesse?
Du wolltest schon immer bei einem innovativen automotive Startup arbeiten? Dann bewirb dich jetzt mit Angabe deines möglichen Eintrittstermins und deiner Gehaltsvorstellung.";7.0;Als Maschinenbau Master mit Schwerpunkt Data Science bringst du bereits Kenntnisse in Python mit, was eine ähnliche Programmiersprache wie Go ist. Du hast auch Erfahrungen mit der Entwicklung von Backend-Services und REST-API-Entwicklung. Obwohl du noch nicht direkt mit Go gearbeitet hast, hast du die Erfahrung mit einer vergleichbaren Programmiersprache (Python). Du bringst auch Kenntnisse in Continuous Integration/Deployment und Git mit. Es scheint, als könntest du dich schnell in Go einarbeiten und die erforderlichen Fähigkeiten erwerben.
